{
  "id": "tengra-web",
  "name": "Tengra Web",
  "description": "Web search, page reading, and JSON fetch tools packaged as an external MCP plugin.",
  "author": "Tengra Studio",
  "version": "1.0.0",
  "downloadUrl": "https://raw.githubusercontent.com/TengraStudio/tengra-market/main/mcp/tengra-web.mcp.json",
  "itemType": "mcp",
  "category": "web",
  "command": "node",
  "args": [],
  "entrypointUrl": "https://raw.githubusercontent.com/TengraStudio/tengra-market/main/mcp/tengra-mcp-runner.mjs",
  "entrypointFile": "server.mjs",
  "env": {
    "TENGRA_MCP_PLUGIN_ID": "tengra-web"
  },
  "permissionProfile": "network-enabled",
  "tools": [
    {
      "name": "search",
      "description": "Search the web for a query."
    },
    {
      "name": "read_page",
      "description": "Fetch text from an HTTP or HTTPS page."
    },
    {
      "name": "fetch_json",
      "description": "Fetch and parse JSON from an HTTP or HTTPS endpoint."
    }
  ],
  "storage": {
    "dataPath": "tengra-web",
    "quotaMb": 64,
    "migrationVersion": 1
  },
  "capabilities": [
    "network",
    "web"
  ]
}
