{
  "id": "tengra-network",
  "name": "Tengra Network",
  "description": "Ping, traceroute, and whois tools packaged as an external MCP plugin.",
  "author": "Tengra Studio",
  "version": "1.0.0",
  "downloadUrl": "https://raw.githubusercontent.com/TengraStudio/tengra-market/main/mcp/tengra-network.mcp.json",
  "itemType": "mcp",
  "category": "network",
  "command": "node",
  "args": [],
  "entrypointUrl": "https://raw.githubusercontent.com/TengraStudio/tengra-market/main/mcp/tengra-mcp-runner.mjs",
  "entrypointFile": "server.mjs",
  "env": {
    "TENGRA_MCP_PLUGIN_ID": "tengra-network"
  },
  "permissionProfile": "network-enabled",
  "tools": [
    {
      "name": "ping",
      "description": "Run a bounded ping against a host."
    },
    {
      "name": "traceroute",
      "description": "Trace the route to a host."
    },
    {
      "name": "whois",
      "description": "Run a whois lookup for a domain."
    }
  ],
  "storage": {
    "dataPath": "tengra-network",
    "quotaMb": 32,
    "migrationVersion": 1
  },
  "capabilities": [
    "network"
  ]
}
