{
  "id": "tengra-ssh",
  "name": "Tengra SSH",
  "description": "System SSH based connect, execute, and disconnect tools packaged as an external MCP plugin.",
  "author": "Tengra Studio",
  "version": "1.0.0",
  "downloadUrl": "https://raw.githubusercontent.com/TengraStudio/tengra-market/main/mcp/tengra-ssh.mcp.json",
  "itemType": "mcp",
  "category": "network",
  "command": "node",
  "args": [],
  "entrypointUrl": "https://raw.githubusercontent.com/TengraStudio/tengra-market/main/mcp/tengra-mcp-runner.mjs",
  "entrypointFile": "server.mjs",
  "env": {
    "TENGRA_MCP_PLUGIN_ID": "tengra-ssh"
  },
  "permissionProfile": "full-access",
  "tools": [
    {
      "name": "connect",
      "description": "Store a non-secret SSH host descriptor in plugin-local storage."
    },
    {
      "name": "execute",
      "description": "Run a bounded command through the system ssh client."
    },
    {
      "name": "disconnect",
      "description": "Remove a stored SSH host descriptor."
    }
  ],
  "storage": {
    "dataPath": "tengra-ssh",
    "quotaMb": 64,
    "migrationVersion": 1
  },
  "capabilities": [
    "ssh",
    "network"
  ]
}
